{
  "name": "jira-ticket-from-code",
  "description": "Create Jira tickets from TODO/FIXME/BUG code comments by extracting intent and nearby implementation context.",
  "version": "1.0.0",
  "author": {"name": "danforceDJ"},
  "license": "MIT",
  "keywords": ["jira", "tickets", "code-comments", "todo"],
  "category": "productivity",
  "tags": ["jira", "atlassian"],
  "skills": "skills"
}
